Topic,Words,Frequency,Timestamp
100,"drama, television, serial, feminist, medium",1,2019
-1,"intimate, partner violence, intimate partner, ipv, attitude",458,2020
0,"rat, maternal separation, mouse, separation, expression",141,2020
1,"ace, experience ace, household dysfunction, ace exposure, relationship ace",76,2020
2,"emdr, posttraumatic ptsd, traumafocused, tfcbt, ptsd severity",68,2020
3,"csa, csa survivor, history csa, survivor csa, experience csa",40,2020
4,"ipv, intimate partner, intimate, partner violence, violence ipv",40,2020
5,"injury, fracture, head, infant, pediatric",44,2020
6,"attachment, attachment style, insecure, style, insecure attachment",29,2020
7,"covid, pandemic, covid pandemic, coronavirus, lockdown",17,2020
8,"worker, protection, migrant, social work, professional",41,2020
9,"offender, offend, juvenile, crime, justice",43,2020
10,"methylation, dna, dna methylation, gene, epigenetic",43,2020
11,"cortisol, hpa, axis, hpa axis, hair",47,2020
12,"attempt, suicide attempt, suicidal, attempt suicide, ideation",34,2020
13,"cm, cm type, cm exposure, mitochondrial, history cm",14,2020
14,"role resilience, breakup, trait, connordavidson, connordavidson resilience",23,2020
15,"hiv, msm, infection, syndemic, adherence",35,2020
16,"drug, opioid, misuse, cannabis, recovery",35,2020
17,"nssi, selfinjury, nonsuicidal, nonsuicidal selfinjury, selfinjury nssi",15,2020
18,"psychosis, psychotic, fep, firstepisode psychosis, hallucination",32,2020
19,"class, latent class, latent, lca, ace",25,2020
20,"church, catholic, clergy, religious, crisis",21,2020
21,"bpd, borderline, borderline personality, personality bpd, facial",29,2020
22,"rape, assault, perpetrator, myth, assault victim",28,2020
23,"mdd, major depressive, depressive mdd, medication adherence, glutamate",15,2020
24,"interviewer, forensic interview, forensic, investigative, allege",30,2020
25,"pain, chronic pain, opioid, fibromyalgia, sensitization",26,2020
26,"eat, ed, nervosa, eating, binge",19,2020
27,"sleep, sleep quality, sleep disturbance, disturbance, sleep problem",18,2020
28,"connectivity, functional, functional connectivity, amygdala, cortex",24,2020
29,"bd, bipolar, mood, bipolar bd, episode",24,2020
30,"emotion regulation, emotion dysregulation, dysregulation, difficulty emotion, regulation difficulty",20,2020
31,"suicidal ideation, suicidal, ideation, suicidal thought, internet addiction",18,2020
32,"psychometric, psychometric property, property, internal consistency, consistency",22,2020
33,"dissociation, dissociative, dissociative experience, somatoform, dissociative identity",17,2020
34,"violence exposure, experience violence, genderbased, genderbased violence, family violence",18,2020
35,"disability, intellectual, intellectual disability, sexuality, id",16,2020
36,"nonconsensual, imagebased, porn, pornography, revenge",5,2020
37,"parentchild, aboriginal, parenting, caregiver, parentchild interaction",18,2020
38,"sport, athlete, coach, leadership, harassment",19,2020
39,"mother, maternal, intergenerational, maternal depression, motherchild",14,2020
40,"depression anxiety, anxiety depression, negative event, depressive anxiety, recent stressor",21,2020
41,"externalize, internalize, internalize externalize, externalize problem, internalize problem",19,2020
42,"college, college student, title, teach, student experience",17,2020
43,"traumainformed, traumainformed care, consumer, classroom, tie",11,2020
44,"elder, elderly, mistreatment, financial, old person",24,2020
45,"foster, foster care, placement, residential, residential care",19,2020
46,"perceive social, support positive, abortion, positive coping, oxytocin",16,2020
47,"memory, autobiographical, false, autobiographical memory, intrusive",14,2020
48,"teacher, classroom, climate, knowledge attitude, parent teacher",14,2020
49,"coercion, vaginal, microbiome, choice, automatic thought",12,2020
50,"trait, personality function, narcissism, narcissistic, pd",13,2020
51,"disclosure, disclose, tell, csa, delay",18,2020
52,"selfesteem, depression selfesteem, pride, malicious, benign",13,2020
53,"adverse event, asthma, growth, earthquake, trajectory",16,2020
54,"military, veteran, combat, personnel, deployment",13,2020
55,"psychotherapy, sp, antidepressant, recurrence, major depression",17,2020
56,"polyvictimization, type victimization, victimization experience, attractiveness, illicit drug",11,2020
57,"young people, masculinity, people experience, qualitative, island",13,2020
58,"inflammation, il, inflammatory, crp, creactive",23,2020
59,"intimate partner, partner violence, intimate, economic, violence woman",12,2020
60,"cardiovascular, disease, cvd, autonomic, cardiovascular disease",13,2020
61,"subjective wellbeing, wellbeing adulthood, identity development, subjective, identity",7,2020
62,"mindfulness, relationship quality, couple, satisfaction, romantic",10,2020
63,"executive, executive function, ef, neuropsychological, deficit",21,2020
64,"csam, law, law enforcement, enforcement, pornography",11,2020
65,"ct, psychosis, god, schizophrenia, religiosity",13,2020
66,"aud, alcoholrelated, drink, alcohol misuse, drinking",15,2020
67,"alexithymia, toronto, toronto alexithymia, feeling, difficulty identify",17,2020
68,"pregnancy, postpartum, perinatal, unintended, unintended pregnancy",20,2020
69,"prevention program, ge, skill, curriculum, schoolbased",14,2020
70,"ptg, posttraumatic growth, revictimization, growth, assumption",11,2020
71,"domestic, domestic violence, coercive, dv, father",16,2020
72,"aggression, aggressive, selfcontrol, anger, trait",11,2020
73,"caregiver, caregiver support, baby, caregiver experience, anger hostility",9,2020
74,"infant, motherinfant, maternal, mother, postpartum",14,2020
75,"family member, social withdrawal, incest, incarceration, family dynamic",11,2020
76,"writer, character, fiction, transformation, conversation",7,2020
77,"aor, aor ci, ethiopia, ci aor, migrant",11,2020
78,"selfcompassion, sc, compassion, ptsd alcohol, alcohol misuse",4,2020
79,"latent profile, latent, kinship, cancer, normative",4,2020
80,"date violence, perpetration, dv, moral disengagement, violence victimization",15,2020
81,"childbirth, maternity, respectful, birth, facility",13,2020
82,"cptsd, ptsd cptsd, icd, complex ptsd, ptsd complex",7,2020
83,"dementia, experience adverse, complaint, deviant, experience substance",9,2020
84,"cortical, thickness, cortical thickness, matter, insular",13,2020
85,"homosexual, men woman, gay, msm, nonconsensual",10,2020
86,"selfharm, deliberate selfharm, deliberate, parental death, criminality",6,2020
87,"schizophrenia, schizophrenia spectrum, spectrum, psychosis, severe illness",16,2020
88,"node, social network, framing, energy, network approach",7,2020
89,"bully, bullying, bully victimization, workplace, peer bully",12,2020
90,"gut, ibs, axis, bowel, bowel syndrome",9,2020
91,"workplace, nurse, healthcare, staff, worker",8,2020
92,"genetic, polymorphism, gene, geneenvironment, maoa",16,2020
93,"ocd, obsessivecompulsive, obsessive compulsive, obsessive, compulsive",15,2020
94,"reward, biological, processing, affective anxiety, externalize",2,2020
95,"sibling, ssa, chronic disease, cac, incest",5,2020
96,"addiction, internet, internet addiction, smartphone, game",6,2020
97,"cop strategy, cop style, style, coping, religious",16,2020
98,"vaccination, infection, acquire, genital, rash",7,2020
99,"adhd, hyperactivity, deficit hyperactivity, attentiondeficit, hyperactivity adhd",9,2020
100,"medium, social medium, metoo, sentiment, cyberbullying",6,2020
101,"job, overprotection, paternal, parental overprotection, parental care",7,2020
102,"deprivation, ela, threat deprivation, deprivationrelated, pubertal",6,2020
103,"racial, african american, black, american, african",10,2020
104,"ci ci, mortality, hr ci, migraine, hr",10,2020
-1,"partner violence, intimate partner, ipv, intimate, mother",579,2021
0,"rat, mouse, maternal separation, separation, el",163,2021
1,"ace, experience ace, ace exposure, ace ace, household dysfunction",99,2021
2,"posttraumatic ptsd, emdr, traumafocused, ptsd severity, complex ptsd",84,2021
3,"csa, survivor csa, experience csa, csa survivor, csa experience",64,2021
4,"ipv, intimate partner, intimate, partner violence, violence ipv",55,2021
5,"injury, fracture, infant, head, pediatric",59,2021
6,"attachment, attachment style, style, insecure, insecure attachment",46,2021
7,"covid, pandemic, covid pandemic, lockdown, coronavirus",50,2021
8,"worker, protection, social worker, professional, contraceptive",45,2021
9,"offender, offend, juvenile, criminal, justice",41,2021
10,"methylation, dna, dna methylation, gene, epigenetic",46,2021
11,"cortisol, axis, hpa, hpa axis, hair",61,2021
12,"attempt, suicide attempt, suicidal, ideation, attempt suicide",41,2021
13,"cm, mdd, distrust, ssd, experience cm",21,2021
14,"app, role resilience, connordavidson, resilience depression, connordavidson resilience",37,2021
15,"hiv, live hiv, infection, adherence, antiretroviral",36,2021
16,"drug, misuse, cannabis, opioid, parental substance",41,2021
17,"nssi, selfinjury, nonsuicidal, nonsuicidal selfinjury, selfinjury nssi",15,2021
18,"psychosis, psychotic, hallucination, fep, firstepisode psychosis",30,2021
19,"class, latent class, latent, membership, lca",25,2021
20,"church, catholic, clergy, religious, crisis",40,2021
21,"bpd, borderline, borderline personality, personality bpd, impulsivity",32,2021
22,"rape, perpetrator, assault, myth, tonic",31,2021
23,"mdd, major depressive, sic, depressive mdd, antidepressant",21,2021
24,"interviewer, forensic interview, investigative, forensic, rapport",31,2021
25,"pain, chronic pain, pelvic pain, pelvic, catastrophizing",24,2021
26,"eat, ed, eating, binge eat, binge",34,2021
27,"sleep, sleep quality, sleep disturbance, disturbance, sleep problem",28,2021
28,"connectivity, functional, functional connectivity, restingstate, amygdala",33,2021
29,"bd, bipolar, mood, bipolar bd, affective lability",25,2021
30,"emotion regulation, emotion dysregulation, dysregulation, er, regulation strategy",20,2021
31,"suicidal ideation, ideation, suicidal, relationship suicidal, rd",23,2021
32,"psychometric, psychometric property, property, internal consistency, consistency",20,2021
33,"dissociative, dissociation, dissociative experience, dissociative identity, identity",19,2021
34,"violence exposure, exposure violence, genderbased, experience violence, firearm",28,2021
35,"disability, intellectual, intellectual disability, id, sexuality",23,2021
36,"imagebased, sexting, image, nonconsensual, revenge",16,2021
37,"parentchild, parentchild relationship, parent parent, parenting, parentchild interaction",25,2021
38,"sport, athlete, coach, interpersonal violence, official",6,2021
39,"mother, maternal, intergenerational, motherchild, dialogue",25,2021
40,"depression anxiety, anxiety depression, migraine, headache, trait anxiety",21,2021
41,"externalize, internalize, internalize externalize, externalize problem, internalize problem",23,2021
42,"college, college student, betrayal, campus, academic",19,2021
43,"traumainformed, traumainformed care, traumainformed practice, traumainformed approach, healthcare",25,2021
44,"elder, mistreatment, elderly, financial, ea",23,2021
45,"foster care, foster, outofhome, outofhome care, placement",19,2021
46,"perceive social, role social, support depressive, perfectionism, previous experience",18,2021
47,"memory, autobiographical, false, autobiographical memory, recover",21,2021
48,"teacher, learner, attitude, parent teacher, preschool",16,2021
49,"smi, family plan, planning, reproductive, slum",22,2021
50,"trait, personality trait, personality function, rf, maladaptive personality",11,2021
51,"disclosure, disclose, csa, tell, recipient",21,2021
52,"selfesteem, rosenberg, substance dependence, role selfesteem, momentary",15,2021
53,"frailty, gd, survival, healthy age, tone",18,2021
54,"veteran, military, combat, military veteran, attempt",25,2021
55,"psychotherapy, aggressive behavior, antidepressant, major depression, ketamine",19,2021
56,"polyvictimization, violent victimization, type victimization, minority, victimization experience",25,2021
57,"young people, residential, residential care, safety, barrier",12,2021
58,"il, inflammation, inflammatory, cytokine, immune",25,2021
59,"intimate, intimate partner, partner violence, economic, coercive",25,2021
60,"disease, cardiovascular, heart, cardiovascular disease, cardiovascular reactivity",15,2021
61,"resilience wellbeing, satisfaction, subjective wellbeing, biopsychosocial, affect wellbeing",8,2021
62,"mindfulness, satisfaction, relationship satisfaction, couple, romantic relationship",21,2021
63,"executive, executive function, ef, performance, work memory",16,2021
64,"csam, company, pornography, material csam, earn",8,2021
65,"ct, schizophrenia, history ct, psychosis, episode",13,2021
66,"drinking, drink, aud, alcohol problem, ai",15,2021
67,"alexithymia, toronto, toronto alexithymia, ta, pnes",15,2021
68,"pregnancy, postpartum, perinatal, pregnant, ppd",14,2021
69,"schoolbased, prevention program, curriculum, skill, knowledge skill",12,2021
70,"recovery, spirituality, discourse, heal, saint",12,2021
71,"domestic, domestic violence, witness domestic, witness, defendant",14,2021
72,"aggression, aggressive, reactive, plasma oxytocin, partner aggression",14,2021
73,"caregiver, caregiver support, nonoffending, moderator, caregiverchild",12,2021
74,"infant, motherinfant, maternal, postpartum, mother",19,2021
75,"family function, poor family, family friend, homicide, friend",5,2021
76,"narrative, voice, story, writing, write",17,2021
77,"aor ci, aor, ethiopia, ci aor, bpd",11,2021
78,"selfcompassion, compassion, shame, posttraumatic growth, growth",17,2021
79,"latent profile, latent, fatigue, positive affect, puerto",9,2021
80,"date violence, perpetration, cyber, bystander, warn",11,2021
81,"childbirth, delivery, mistreatment, facility, birth",10,2021
82,"cptsd, icd, ptsd cptsd, complex ptsd, dso",11,2021
83,"social capital, capital, experience adverse, diabetes, dementia",14,2021
84,"cortical, thickness, cortical thickness, matter, volume",15,2021
85,"men woman, masculinity, gay, woman men, msm",24,2021
86,"selfharm, repetition, deliberate selfharm, deliberate, admission",11,2021
87,"schizophrenia, tom, cognition, social cognition, psychosis",10,2021
88,"mistrust, centrality, node, central, social network",7,2021
89,"bully, bullying, bully victimization, perpetration, experience bully",12,2021
90,"gut, microbiome, gut microbiome, axis, composition",16,2021
91,"workplace, nurse, emergency, employee, resident",9,2021
92,"genetic, gene, geneenvironment, polymorphism, fkbp",16,2021
93,"ocd, obsessivecompulsive, social phobia, compulsive, obsessive compulsive",9,2021
94,"reward, neural, anticipation, task, monetary",16,2021
95,"sibling, incest, ssa, intrafamilial, forensic interview",15,2021
96,"addiction, internet addiction, internet, addictive, problematic",5,2021
97,"cop style, religious, cop strategy, style, coping",11,2021
98,"infection, sti, genital, rare, vaginal",13,2021
99,"adhd, hyperactivity, attentiondeficit, attentiondeficit hyperactivity, hyperactivity adhd",9,2021
100,"medium, social medium, metoo, news, discourse",8,2021
101,"violence parental, family violence, alienation, pbi, sexism",12,2021
102,"deprivation, threat deprivation, deprivation threat, dimensional, st",5,2021
103,"racial, black, american, race, african american",12,2021
104,"difference ci, schoolchildren, irr ci, arthritis, irr",12,2021
-1,"intimate partner, intimate, ipv, partner violence, attitude",611,2022
0,"rat, mouse, maternal separation, el, separation",124,2022
1,"ace, experience ace, household dysfunction, ace ace, relationship ace",110,2022
2,"emdr, posttraumatic ptsd, traumafocused, randomize, ptsd depression",72,2022
3,"csa, experience csa, csa survivor, survivor csa, peritraumatic",58,2022
4,"ipv, intimate partner, intimate, partner violence, violence ipv",52,2022
5,"injury, fracture, infant, skeletal, head",53,2022
6,"attachment, attachment style, style, insecure, insecure attachment",51,2022
7,"covid, pandemic, covid pandemic, lockdown, impact covid",60,2022
8,"worker, protection, decision, social worker, barrier",30,2022
9,"offender, crime, criminal, offend, juvenile",43,2022
10,"methylation, dna, dna methylation, epigenetic, gene",48,2022
11,"cortisol, hpa, axis, hpa axis, diurnal",29,2022
12,"attempt, suicide attempt, suicidal, ideation, attempt suicide",46,2022
13,"cm, history cm, cm type, mdd, cm history",31,2022
14,"cdrisc, resilience depression, role resilience, connordavidson, connordavidson resilience",42,2022
15,"hiv, live hiv, hiv aid, aid, msm",34,2022
16,"drug, sud, cannabis, opioid, marijuana",30,2022
17,"nssi, selfinjury, nonsuicidal, nonsuicidal selfinjury, selfinjury nssi",25,2022
18,"psychosis, psychotic, chr, fep, schizophrenia",33,2022
19,"class, latent class, latent, lca, ace",36,2022
20,"church, catholic, clergy, religious, spiritual",40,2022
21,"bpd, borderline, borderline personality, personality bpd, trait",29,2022
22,"rape, rape myth, assault, myth, perpetrator",39,2022
23,"mdd, major depressive, depressive mdd, gyrus, magnetic",30,2022
24,"interviewer, forensic interview, forensic, investigative, police",31,2022
25,"pain, chronic pain, pelvic, fm, pelvic pain",30,2022
26,"eat, binge eat, binge, ed, nervosa",26,2022
27,"sleep, sleep quality, sleep disturbance, disturbance, insomnia",28,2022
28,"connectivity, functional, functional connectivity, amygdala, restingstate",27,2022
29,"bd, bipolar, mood, bipolar bd, episode",32,2022
30,"emotion regulation, emotion dysregulation, dysregulation, regulation strategy, suppression",29,2022
31,"suicidal ideation, ideation, suicidal, depression suicidal, relationship suicidal",21,2022
32,"psychometric, psychometric property, property, internal consistency, consistency",27,2022
33,"dissociative, dissociation, amnesia, dissociative experience, dissociative identity",28,2022
34,"violence exposure, genderbased, genderbased violence, gbv, exposure violence",23,2022
35,"disability, intellectual, intellectual disability, id, sexuality",27,2022
36,"imagebased, nonconsensual, image, sexting, pornography",21,2022
37,"parentchild, parentchild relationship, mindful, parenting, parentchild interaction",16,2022
38,"sport, athlete, coach, harassment, safeguard",35,2022
39,"mother, maternal, intergenerational, motherchild, transmission",34,2022
40,"depression anxiety, anxiety depression, trait anxiety, malicious, benign",17,2022
41,"externalize, internalize, internalize externalize, externalize problem, internalize problem",25,2022
42,"college, college student, faculty, preclinical, vignette",22,2022
43,"traumainformed, traumainformed care, staff, principle, yoga",22,2022
44,"elder, mistreatment, elderly, financial, dementia",29,2022
45,"foster, foster care, placement, welfare, outofhome",17,2022
46,"perceive social, forum, ptes, paranoia, need care",22,2022
47,"memory, false, autobiographical, autobiographical memory, amnesia",24,2022
48,"teacher, classroom, climate, educator, preschool",20,2022
49,"epilepsy, woman experience, transport, involuntary, menopause",19,2022
50,"trait, personality trait, personality function, pd, personality pathology",26,2022
51,"disclosure, disclose, csa, reaction, tell",18,2022
52,"selfesteem, rosenberg, rosenberg selfesteem, cyberbullying, chinese",15,2022
53,"disadvantage, poverty, mortality, adverse event, trajectory",20,2022
54,"veteran, military, combat, military service, military veteran",28,2022
55,"psychotherapy, rumination, invasive, blend, remission",14,2022
56,"polyvictimization, assault, type victimization, revictimization, victimization experience",23,2022
57,"young people, people experience, autistic, helpseeking, hurt",18,2022
58,"il, inflammation, inflammatory, cytokine, crp",14,2022
59,"intimate partner, intimate, partner violence, economic, dependence",17,2022
60,"disease, cardiovascular, diabetes, heart, cardiovascular disease",21,2022
61,"subjective wellbeing, subjective, satisfaction, wellbeing young, experience homelessness",21,2022
62,"mindfulness, relationship satisfaction, satisfaction, relationship quality, couple",13,2022
63,"executive, executive function, ef, performance, work memory",21,2022
64,"csam, material csam, technology, pornography, investigator",11,2022
65,"ct, relationship ct, block, schizophrenia, antipsychotic",15,2022
66,"drink, drinking, aud, problematic alcohol, alcoholrelated",17,2022
67,"alexithymia, toronto, toronto alexithymia, feeling, subjectively",12,2022
68,"pregnancy, postpartum, perinatal, pregnant, prenatal",18,2022
69,"prevention program, schoolbased, curriculum, safety, skill",17,2022
70,"redress, scheme, experience survivor, heal, intrafamilial",18,2022
71,"domestic, domestic violence, dv, victim domestic, witness",22,2022
72,"aggression, aggressive, cyber, subordinate, fluoxetine",23,2022
73,"caregiver, caregiver support, caregiver history, caregiver experience, nonoffending",19,2022
74,"infant, motherinfant, maternal, mother, postpartum",15,2022
75,"latinx, family member, academic achievement, family environment, family function",21,2022
76,"narrative, definition, adoption, organisational, epistemic",16,2022
77,"aor ci, aor, ci aor, ethiopia, concussion",18,2022
78,"selfcompassion, shame, selfcriticism, compassion, cyberbullying victimization",14,2022
79,"latent profile, latent, lpa, distinct profile, variant",15,2022
80,"date violence, perpetration, cyber, dv, violence perpetration",20,2022
81,"childbirth, birth, obstetric, maternity, respectful",16,2022
82,"cptsd, icd, ptsd cptsd, complex posttraumatic, dso",15,2022
83,"capital, deviant, human capital, severe anxiety, experience adverse",19,2022
84,"cortical, thickness, cortical thickness, matter, volume",11,2022
85,"masculinity, gay men, masochism, debut, gay",11,2022
86,"selfharm, harm, selfharm suicide, attempt, suicide attempt",18,2022
87,"schizophrenia, psychotic, psychosis, social functioning, deficit",21,2022
88,"neural network, node, helpseeking, network approach, edge",7,2022
89,"bully, bully victimization, bullying, chr, cyberbullying",11,2022
90,"gut, microbiome, axis, visceral, ibs",13,2022
91,"nurse, workplace, burnout, healthcare, worker",8,2022
92,"genetic, gene, val, polymorphism, genotype",19,2022
93,"ocd, obsessivecompulsive, oxtr, thalamic, obsessive compulsive",8,2022
94,"reward, decisionmaking, striatum, task, reward sensitivity",18,2022
95,"sibling, ssa, incest, intrafamilial, disclosure",8,2022
96,"addiction, internet addiction, internet, smartphone, ia",7,2022
97,"cop strategy, cop style, symptomology, religious, style",6,2022
98,"genital, infection, lesion, rare, transmission",13,2022
99,"adhd, hyperactivity, attentiondeficit, deficit hyperactivity, attentiondeficit hyperactivity",12,2022
100,"medium, social medium, coverage, metoo, news",12,2022
101,"pa, alienation, parental education, divorce, parental marital",14,2022
102,"deprivation, threat deprivation, deprivation threat, reproductive strategy, dimensional",11,2022
103,"racial, black, racial discrimination, discrimination, american",8,2022
104,"hr ci, hr, medicaid, ci ci, apr ci",12,2022
-1,"attitude, shame, intimate, intimate partner, partner violence",588,2023
0,"mouse, rat, el, maternal separation, separation",130,2023
1,"ace, experience ace, household dysfunction, ace exposure, aceiq",119,2023
2,"posttraumatic ptsd, emdr, traumafocused, ptsd severity, reprocess",61,2023
3,"csa, csa survivor, survivor csa, experience csa, csa experience",63,2023
4,"ipv, intimate partner, intimate, partner violence, violence ipv",49,2023
5,"injury, fracture, infant, head, pediatric",59,2023
6,"attachment, attachment style, style, insecure, insecure attachment",58,2023
7,"covid, pandemic, covid pandemic, lockdown, impact covid",64,2023
8,"worker, protection, social work, welfare, barrier",47,2023
9,"offender, criminal, crime, offend, juvenile",35,2023
10,"methylation, dna, dna methylation, epigenetic, gene",37,2023
11,"cortisol, axis, hpa, hpa axis, hair",43,2023
12,"attempt, suicide attempt, suicidal, ideation, suicidal thought",35,2023
13,"cm, relationship cm, cm exposure, form cm, history cm",40,2023
14,"connordavidson, connordavidson resilience, relationship resilience, grandparent, cdrisc",30,2023
15,"hiv, live hiv, adherence, hiv aid, aid",26,2023
16,"cannabis, drug, opioid, prescription, sud",25,2023
17,"nssi, selfinjury, nonsuicidal, nonsuicidal selfinjury, selfinjury nssi",33,2023
18,"psychosis, psychotic, fep, firstepisode psychosis, firstepisode",36,2023
19,"class, latent class, latent, lca, ace",40,2023
20,"church, catholic, clergy, religious, crisis",23,2023
21,"bpd, borderline, borderline personality, personality bpd, impulsivity",28,2023
22,"rape, perpetrator, myth, rape myth, assault",30,2023
23,"mdd, major depressive, depressive mdd, gyrus, hcs",38,2023
24,"interviewer, investigative, forensic interview, forensic, feedback",29,2023
25,"pain, chronic pain, pelvic pain, pelvic, catastrophizing",30,2023
26,"eat, ed, binge eat, binge, eating",31,2023
27,"sleep, sleep quality, sleep disturbance, disturbance, sleep duration",26,2023
28,"connectivity, functional, functional connectivity, restingstate, restingstate functional",25,2023
29,"bd, bipolar, mood, bipolar bd, episode",31,2023
30,"emotion regulation, dysregulation, emotion dysregulation, regulation strategy, suppression",29,2023
31,"suicidal ideation, suicidal, ideation, character, relationship suicidal",23,2023
32,"psychometric, psychometric property, property, internal consistency, convergent",22,2023
33,"dissociation, dissociative, dissociative experience, depersonalization, dissociative identity",25,2023
34,"violence exposure, genderbased, genderbased violence, exposure violence, family violence",29,2023
35,"disability, intellectual, intellectual disability, disabled, id",22,2023
