Topic,Words,Frequency,Timestamp
77,"aor ci, aor, seizure, report history, private",1,2026
78,"selfcompassion, surgery, marital quality, acceptance, marital",4,2026
79,"latent profile, latent, social competence, profile identify, distinct profile",4,2026
80,"date violence, perpetration, dv, iv, victimization perpetration",2,2026
82,"cptsd, serious illness, smi, class, ptsd cptsd",1,2026
83,"audit, psychosis, different setting, support adverse, least adverse",1,2026
84,"internalize, cortical, internalize psychopathology, cortical thickness, thickness",1,2026
85,"seek support, experience harm, preference, men experience, harm",2,2026
86,"selfharm, digital, explanation, dark triad, triad",3,2026
87,"schizophrenia, sz, schizotypal, schizophrenia spectrum, severity positive",2,2026
88,"negative state, paranoid, rejection sensitivity, rejection, comorbid anxiety",2,2026
89,"bully, sz, bp, pfdr, hc",1,2026
90,"ibs, hypersensitivity, sn, visceral, sympathetic",1,2026
91,"nurse, negative cop, shift, workplace, univariate",1,2026
93,"ocd, contamination, obsessivecompulsive, sle, sad",2,2026
94,"sensory, sensory processing, processing, sensory process, chart",1,2026
95,"sibling, incest, twin, ssa, strain",6,2026
96,"addiction, internet addiction, internet, dysregulation depression, game",2,2026
97,"cop style, cop strategy, style, medication, shame",4,2026
99,"adhd, se, hyperactivity, attentiondeficit, attentiondeficit hyperactivity",2,2026
100,"medium, taboo, news, social medium, discourse",2,2026
101,"stranger, danger, teach, independence, balance",1,2026
102,"deprivation, material deprivation, worry, depression link, complete semistructured",1,2026
103,"black, racial, race, native, white",3,2026
